uri,publishedDate,publisher/name,publisher/scheme,publisher/uid,publisher/uri,version,extensions/0,extensions/1,extensions/2,extensions/3,extensions/4,extensions/5,extensions/6,license,publicationPolicy,releases/0/ocid,releases/0/id,releases/0/language,releases/0/date,releases/0/tag/0,releases/0/initiationType,releases/0/title,releases/0/planning/milestones/0/id,releases/0/planning/milestones/0/title,releases/0/planning/milestones/0/type,releases/0/planning/milestones/0/dueDate,releases/0/planning/budget/budgetBreakdown/0/id,releases/0/planning/budget/budgetBreakdown/0/period/startDate,releases/0/planning/budget/budgetBreakdown/0/period/endDate,releases/0/planning/budget/budgetBreakdown/0/description,releases/0/planning/budget/budgetBreakdown/0/amount/amount,releases/0/planning/budget/budgetBreakdown/0/amount/currency,releases/0/planning/documents/0/id,releases/0/planning/documents/0/documentType,releases/0/planning/documents/0/description,releases/0/planning/documents/0/url,releases/0/planning/documents/0/datePublished,releases/0/planning/documents/0/format,releases/0/planning/documents/0/language,releases/0/planning/documents/1/id,releases/0/planning/documents/1/documentType,releases/0/planning/documents/1/description,releases/0/planning/documents/1/url,releases/0/planning/documents/1/format,releases/0/tender/id,releases/0/tender/title,releases/0/tender/description,releases/0/tender/datePublished,releases/0/tender/status,releases/0/tender/classification/scheme,releases/0/tender/classification/id,releases/0/tender/classification/description,releases/0/tender/additionalClassifications/0/scheme,releases/0/tender/additionalClassifications/0/id,releases/0/tender/additionalClassifications/0/description,releases/0/tender/additionalClassifications/1/scheme,releases/0/tender/additionalClassifications/1/id,releases/0/tender/additionalClassifications/1/description,releases/0/tender/additionalClassifications/2/scheme,releases/0/tender/additionalClassifications/2/id,releases/0/tender/additionalClassifications/2/description,releases/0/tender/additionalClassifications/3/scheme,releases/0/tender/additionalClassifications/3/id,releases/0/tender/additionalClassifications/3/description,releases/0/tender/additionalClassifications/4/scheme,releases/0/tender/additionalClassifications/4/id,releases/0/tender/additionalClassifications/4/description,releases/0/tender/additionalClassifications/5/scheme,releases/0/tender/additionalClassifications/5/id,releases/0/tender/additionalClassifications/5/description,releases/0/tender/additionalClassifications/6/scheme,releases/0/tender/additionalClassifications/6/id,releases/0/tender/additionalClassifications/6/description,releases/0/tender/additionalClassifications/7/scheme,releases/0/tender/additionalClassifications/7/id,releases/0/tender/additionalClassifications/7/description,releases/0/tender/additionalClassifications/8/scheme,releases/0/tender/additionalClassifications/8/id,releases/0/tender/additionalClassifications/8/description,releases/0/tender/additionalClassifications/9/scheme,releases/0/tender/additionalClassifications/9/id,releases/0/tender/additionalClassifications/9/description,releases/0/tender/additionalClassifications/10/scheme,releases/0/tender/additionalClassifications/10/id,releases/0/tender/additionalClassifications/10/description,releases/0/tender/additionalClassifications/11/scheme,releases/0/tender/additionalClassifications/11/id,releases/0/tender/additionalClassifications/11/description,releases/0/tender/additionalClassifications/12/scheme,releases/0/tender/additionalClassifications/12/id,releases/0/tender/additionalClassifications/12/description,releases/0/tender/items/0/id,releases/0/tender/items/0/deliveryAddresses/0/region,releases/0/tender/items/0/deliveryAddresses/0/countryName,releases/0/tender/items/0/deliveryAddresses/0/postalCode,releases/0/tender/items/0/deliveryAddresses/1/region,releases/0/tender/items/0/deliveryAddresses/1/countryName,releases/0/tender/items/0/deliveryAddresses/2/region,releases/0/tender/items/0/deliveryAddresses/2/countryName,releases/0/tender/items/0/deliveryAddresses/3/region,releases/0/tender/items/0/deliveryAddresses/3/countryName,releases/0/tender/items/0/deliveryAddresses/4/region,releases/0/tender/items/0/deliveryAddresses/4/countryName,releases/0/tender/items/0/deliveryAddresses/5/region,releases/0/tender/items/0/deliveryAddresses/5/countryName,releases/0/tender/items/0/deliveryAddresses/6/region,releases/0/tender/items/0/deliveryAddresses/6/countryName,releases/0/tender/minValue/amount,releases/0/tender/minValue/currency,releases/0/tender/items/0/deliveryAddresses/7/region,releases/0/tender/items/0/deliveryAddresses/7/countryName,releases/0/tender/items/0/deliveryAddresses/8/region,releases/0/tender/items/0/deliveryAddresses/8/countryName,releases/0/tender/items/0/deliveryAddresses/9/region,releases/0/tender/items/0/deliveryAddresses/9/countryName,releases/0/tender/value/amount,releases/0/tender/value/currency,releases/0/tender/procurementMethod,releases/0/tender/procurementMethodDetails,releases/0/tender/tenderPeriod/endDate,releases/0/tender/communication/futureNoticeDate,releases/0/tender/contractPeriod/startDate,releases/0/tender/contractPeriod/endDate,releases/0/tender/suitability/sme,releases/0/tender/suitability/vcse,releases/0/tender/mainProcurementCategory,releases/0/tender/documents/0/id,releases/0/tender/documents/0/documentType,releases/0/tender/documents/0/description,releases/0/tender/documents/0/url,releases/0/tender/documents/0/datePublished,releases/0/tender/documents/0/format,releases/0/tender/documents/0/language,releases/0/tender/documents/1/id,releases/0/tender/documents/1/documentType,releases/0/tender/documents/1/description,releases/0/tender/documents/1/url,releases/0/tender/documents/1/format,releases/0/tender/documents/2/id,releases/0/tender/documents/2/documentType,releases/0/tender/documents/2/description,releases/0/tender/documents/2/url,releases/0/tender/documents/2/format,releases/0/tender/documents/3/id,releases/0/tender/documents/3/documentType,releases/0/tender/documents/3/description,releases/0/tender/documents/3/url,releases/0/tender/documents/3/format,releases/0/tender/documents/4/id,releases/0/tender/documents/4/documentType,releases/0/tender/documents/4/description,releases/0/tender/documents/4/url,releases/0/tender/documents/4/format,releases/0/parties/0/id,releases/0/parties/0/name,releases/0/parties/0/identifier/legalName,releases/0/parties/0/identifier/scheme,releases/0/parties/0/identifier/id,releases/0/parties/0/address/streetAddress,releases/0/parties/0/address/locality,releases/0/parties/0/address/postalCode,releases/0/parties/0/address/countryName,releases/0/parties/0/contactPoint/name,releases/0/parties/0/contactPoint/email,releases/0/parties/0/contactPoint/telephone,releases/0/parties/0/details/url,releases/0/parties/0/roles/0,releases/0/parties/1/id,releases/0/parties/1/name,releases/0/parties/1/identifier/legalName,releases/0/parties/1/address/streetAddress,releases/0/parties/1/details/scale,releases/0/parties/1/details/vcse,releases/0/parties/1/roles/0,releases/0/parties/2/id,releases/0/parties/2/name,releases/0/parties/2/identifier/legalName,releases/0/parties/2/address/streetAddress,releases/0/parties/2/details/scale,releases/0/parties/2/details/vcse,releases/0/parties/2/roles/0,releases/0/parties/3/id,releases/0/parties/3/name,releases/0/parties/3/identifier/legalName,releases/0/parties/3/address/streetAddress,releases/0/parties/3/details/scale,releases/0/parties/3/details/vcse,releases/0/parties/3/roles/0,releases/0/buyer/id,releases/0/buyer/name,releases/0/awards/0/id,releases/0/awards/0/status,releases/0/awards/0/date,releases/0/awards/0/datePublished,releases/0/awards/0/value/amount,releases/0/awards/0/value/currency,releases/0/awards/0/suppliers/0/id,releases/0/awards/0/suppliers/0/name,releases/0/awards/0/suppliers/1/id,releases/0/awards/0/suppliers/1/name,releases/0/awards/0/suppliers/2/id,releases/0/awards/0/suppliers/2/name,releases/0/awards/0/contractPeriod/startDate,releases/0/awards/0/contractPeriod/endDate,releases/0/awards/0/description,releases/0/awards/0/documents/0/id,releases/0/awards/0/documents/0/documentType,releases/0/awards/0/documents/0/description,releases/0/awards/0/documents/0/url,releases/0/awards/0/documents/0/datePublished,releases/0/awards/0/documents/0/format,releases/0/awards/0/documents/0/language,releases/0/awards/0/documents/1/id,releases/0/awards/0/documents/1/documentType,releases/0/awards/0/documents/1/description,releases/0/awards/0/documents/1/url,releases/0/awards/0/documents/1/format,releases/0/awards/0/documents/2/id,releases/0/awards/0/documents/2/documentType,releases/0/awards/0/documents/2/description,releases/0/awards/0/documents/2/url,releases/0/awards/0/documents/2/format,releases/0/awards/0/documents/3/id,releases/0/awards/0/documents/3/documentType,releases/0/awards/0/documents/3/description,releases/0/awards/0/documents/3/url,releases/0/awards/0/documents/3/format,releases/0/awards/0/documents/4/id,releases/0/awards/0/documents/4/documentType,releases/0/awards/0/documents/4/description,releases/0/awards/0/documents/4/url,releases/0/awards/0/documents/4/format,releases/0/awards/0/documents/5/id,releases/0/awards/0/documents/5/documentType,releases/0/awards/0/documents/5/description,releases/0/awards/0/documents/5/url,releases/0/awards/0/documents/5/format,releases/0/awards/0/documents/6/id,releases/0/awards/0/documents/6/documentType,releases/0/awards/0/documents/6/description,releases/0/awards/0/documents/6/url,releases/0/awards/0/documents/6/format,releases/0/awards/0/documents/7/id,releases/0/awards/0/documents/7/documentType,releases/0/awards/0/documents/7/description,releases/0/awards/0/documents/7/url,releases/0/awards/0/documents/7/format,releases/0/awards/0/documents/8/id,releases/0/awards/0/documents/8/documentType,releases/0/awards/0/documents/8/description,releases/0/awards/0/documents/8/url,releases/0/awards/0/documents/8/format,releases/0/awards/0/documents/9/id,releases/0/awards/0/documents/9/documentType,releases/0/awards/0/documents/9/description,releases/0/awards/0/documents/9/url,releases/0/awards/0/documents/9/format
https://www.contractsfinder.service.gov.uk/Published/Notice/releases/4315e851-d225-4e89-b012-b9bcf8723d36.json,2017-11-21T23:30:24Z,"Cabinet Office",GB-GOR,D2,https://www.gov.uk/government/organisations/cabinet-office,1.1,https://standard.open-contracting.org/profiles/eu/master/en/extension.json,https://raw.githubusercontent.com/portaledcahn/ocds_tenderDatePublished_extension/master/extension.json,https://raw.githubusercontent.com/open-contracting-extensions/ocds_budget_breakdown_extension/master/extension.json,https://raw.githubusercontent.com/Crown-Commercial-Service/ocds_awards_datePublished_extension/main/extension.json,https://raw.githubusercontent.com/Crown-Commercial-Service/ocds_partyDetails_vcse_extension/main/extension.json,https://raw.githubusercontent.com/Crown-Commercial-Service/ocds_tender_suitability_extension/main/extension.json,https://raw.githubusercontent.com/open-contracting-extensions/ocds_pagination_extension/master/extension.json,http://www.nationalarchives.gov.uk/doc/open-government-licence/version/3/,https://www.gov.uk/government/publications/open-contracting,ocds-b5fd17-6cd0fda2-2cdd-4aad-8ab3-139f4b29c455,4315e851-d225-4e89-b012-b9bcf8723d36-183277,en,2017-11-21T23:30:24Z,tender,tender,,,,,,,,,,,,,,,,,,,,,,,,20171121233022-39,"The Provision of a Core+ 2 Service on behalf of NHS Heywood, Middleton and Rochdale Clinical Commissioning Group","NHS SBS are acting on behalf of NHS Heywood, Middleton and Rochdale Clinical Commissioning Group ('the Contracting Authority')) to obtain a Provider to deliver a clinically safe and competent Core+ 2 Service which is designed to improve outcomes and reduce variation across the whole of the Rochdale Borough covering a population base of approximately 230,000 patients. The Provision of the Core+ 2 Service consists of seven themes, with each theme containing sub indicators, of which can be viewed within the Service Specification located on the EU-Supply Portal. The Contracting Authority seeks responses from interested Providers who wish to deliver the Service as set out in the Service Specification. Interested Providers must complete and submit a Qualification Questionnaire (QQ). Providers are asked to indicate their proposed bidding model within their QQ response. Where Bidder Members are involved in the proposed model they should also complete the required sections of the QQ. Full details of this can be found in the Bidder Instruction Document. All documents are available electronically via EU Supply - https://nhssbs.eu-supply.com. Please see the QQ Bidder Instruction Document for an overview of the procurement process. The QQ includes Grounds for Exclusion, Economic and Financial Standing and Technical and Professional Ability including:
- Contract Specific Technical Questions: A series of scored questions under the criteria of: (1) Deliverability; (2) Quality; (3) Integration and Transformation; and (4) Organisational Sustainability. Some questions ask Bidders to refer to previous experience. Other questions ask Bidders to explain their understanding of local requirements for the Core+2 Service and in some instances their proposed approach to delivery of the Service. This flexibility of approach is utilised as permitted under the 'light touch regime'.
- Standard Technical Questions: A series of Pass/Fail questions dealing with aspects relevant to service provision, for example, CQC Registration, Insurances, Regulatory etc. This will be a Qualification Stage followed by an Award Stage. The Award Stage will involve invitation of proposals which will be evaluated against award criteria and is also likely to include strategic dialogue. Further information will be provided in due course. The contract will be awarded without further advertisement of this opportunity and there will be no further opportunity to express interest. The indicative affordability threshold is £7,400,000 per annum and the Contract will be for a duration of 3 years. The QQ documentation should be completed and submitted by 5pm on 20th December 2017.",2017-11-21T23:30:24Z,active,CPV,85000000,"Health and social work services",CPV,85100000,"Health services",,,,,,,,,,,,,,,,,,,,,,,,,,,,,,,,,,,,,1,"North West","United Kingdom",,,,,,,,,,,,,,1,GBP,,,,,,,22200000,GBP,,"Other - ",2017-12-20T23:59:59Z,,2018-04-01T00:00:00+01:00,2021-03-31T23:59:59+01:00,,,services,1,tenderNotice,"Opportunity notice on Contracts Finder",https://www.contractsfinder.service.gov.uk/Notice/4315e851-d225-4e89-b012-b9bcf8723d36,2017-11-21T23:30:24Z,text/html,en,,,,,,,,,,,,,,,,,,,,,GB-CFS-37879,"NHS Shared Business Services Ltd (NHS SBS)","NHS Shared Business Services Ltd (NHS SBS)",,,"3rd Floor Number One Riverside, Smith Street, Rochdale",Rochdale,"OL16 1XU",ENG,"Rachael Frank",rachael_frank@nhs.net,"+44 1612123714",,buyer,,,,,,,,,,,,,,,,,,,,,,GB-CFS-37879,"NHS Shared Business Services Ltd (NHS SBS)",,,,,,,,,,,,,,,,,,,,,,,,,,,,,,,,,,,,,,,,,,,,,,,,,,,,,,,,,,,,,,,,,,,
https://www.contractsfinder.service.gov.uk/Published/Notice/releases/b9dd3224-b598-4485-900a-87325e6b7af8.json,2017-11-21T23:06:05Z,"Cabinet Office",GB-GOR,D2,https://www.gov.uk/government/organisations/cabinet-office,1.1,https://standard.open-contracting.org/profiles/eu/master/en/extension.json,https://raw.githubusercontent.com/portaledcahn/ocds_tenderDatePublished_extension/master/extension.json,https://raw.githubusercontent.com/open-contracting-extensions/ocds_budget_breakdown_extension/master/extension.json,https://raw.githubusercontent.com/Crown-Commercial-Service/ocds_awards_datePublished_extension/main/extension.json,https://raw.githubusercontent.com/Crown-Commercial-Service/ocds_partyDetails_vcse_extension/main/extension.json,https://raw.githubusercontent.com/Crown-Commercial-Service/ocds_tender_suitability_extension/main/extension.json,https://raw.githubusercontent.com/open-contracting-extensions/ocds_pagination_extension/master/extension.json,http://www.nationalarchives.gov.uk/doc/open-government-licence/version/3/,https://www.gov.uk/government/publications/open-contracting,ocds-b5fd17-e2701af5-a1fe-4b36-a060-5fe347cf1506,b9dd3224-b598-4485-900a-87325e6b7af8-183274,en,2017-11-21T23:06:05Z,tenderAmendment,tender,,,,,,,,,,,,,,,,,,,,,,,,CD1258,"Short Break Residential Services For Disabled Children","Short Break Residential Services For Disabled Children based in identified premises available to be leased from the Council

Additional information: This opportunity is available in the `Current Tenders` area of www.suffolksourcing.uk. 

Interested parties are invited to express their interest in order to gain full access to the tender documentation

Is a Recurrent Procurement Type? : No",2017-11-17T15:38:27Z,active,CPV,85300000,"Social work and related services",CPV,85311300,"Welfare services for children and young people",,,,,,,,,,,,,,,,,,,,,,,,,,,,,,,,,,,,,1,,,"IP1 2BX","East of England","United Kingdom",,,,,,,,,,,,,,,,,,,,,open,"Open procedure (above threshold)",2017-12-22T23:59:59Z,,2018-04-01T00:00:00+01:00,2023-03-31T23:59:59+01:00,1,1,services,1,tenderNotice,"Opportunity notice on Contracts Finder",https://www.contractsfinder.service.gov.uk/Notice/b9dd3224-b598-4485-900a-87325e6b7af8,2017-11-21T23:06:05Z,text/html,en,2,tenderNotice,"Additional information on how to apply for this contract",https://in-tendhost.co.uk/suffolksourcing/aspx/,,,,,,,,,,,,,,,,,GB-CFS-49672,"Suffolk Sourcing","Suffolk Sourcing",,,"Russell Road, Ipswich",Suffolk,"IP1 2BX","United Kingdom","Katrina Browning",katrina.browning@suffolk.gov.uk,"+44 1473264490",https://www.suffolk.gov.uk/business-jobs-and-careers/tenders-and-supplying-us/,buyer,,,,,,,,,,,,,,,,,,,,,,GB-CFS-49672,"Suffolk Sourcing",,,,,,,,,,,,,,,,,,,,,,,,,,,,,,,,,,,,,,,,,,,,,,,,,,,,,,,,,,,,,,,,,,,
https://www.contractsfinder.service.gov.uk/Published/Notice/releases/41d11197-9f88-4759-a83b-bbc366ba5e10.json,2017-11-21T20:55:10Z,"Cabinet Office",GB-GOR,D2,https://www.gov.uk/government/organisations/cabinet-office,1.1,https://standard.open-contracting.org/profiles/eu/master/en/extension.json,https://raw.githubusercontent.com/portaledcahn/ocds_tenderDatePublished_extension/master/extension.json,https://raw.githubusercontent.com/open-contracting-extensions/ocds_budget_breakdown_extension/master/extension.json,https://raw.githubusercontent.com/Crown-Commercial-Service/ocds_awards_datePublished_extension/main/extension.json,https://raw.githubusercontent.com/Crown-Commercial-Service/ocds_partyDetails_vcse_extension/main/extension.json,https://raw.githubusercontent.com/Crown-Commercial-Service/ocds_tender_suitability_extension/main/extension.json,https://raw.githubusercontent.com/open-contracting-extensions/ocds_pagination_extension/master/extension.json,http://www.nationalarchives.gov.uk/doc/open-government-licence/version/3/,https://www.gov.uk/government/publications/open-contracting,ocds-b5fd17-79b5e81c-7891-4c87-b62c-f4328af70304,41d11197-9f88-4759-a83b-bbc366ba5e10-183270,en,2017-11-21T20:55:10Z,award,tender,,,,,,,,,,,,,,,,,,,,,,,,BRISTOLCC001-DN282190-15089405,"Wood Pellet Supply Contract","Supply of wood pellets",,complete,CPV,03413000,"Fuel wood",,,,,,,,,,,,,,,,,,,,,,,,,,,,,,,,,,,,,,,,1,"South West","United Kingdom",,,,,,,,,,,,,,,,,,,,,,95000,GBP,,"Other - ",2017-10-17T23:59:59+01:00,,2017-11-01T00:00:00Z,2018-09-01T23:59:59+01:00,1,1,goods,,,,,,,,,,,,,,,,,,,,,,,,,,,,GB-CFS-51922,"Bristol City Council","Bristol City Council",,,"City Hall, College Green",Bristol,"BS1 5TR","United Kingdom","Jacqueline Miller",jacqueline.miller@bristol.gov.uk,"+44 1173521181",https://www.bristol.gov.uk/,buyer,GB-CFS-73005,"Billington Bio Energy Ltd","Billington Bio Energy Ltd","Cunard Building, Liverpool, Merseyside, L3 1EL, United Kingdom",large,,supplier,,,,,,,,,,,,,,,GB-CFS-51922,"Bristol City Council",ocds-b5fd17-79b5e81c-7891-4c87-b62c-f4328af70304-1,active,2017-11-21T00:00:00Z,2017-11-21T20:55:10Z,133725.2,GBP,GB-CFS-73005,"Billington Bio Energy Ltd",,,,,2017-12-01T00:00:00Z,2018-11-30T23:59:59Z,,1,awardNotice,"Awarded contract notice on Contracts Finder",https://www.contractsfinder.service.gov.uk/Notice/41d11197-9f88-4759-a83b-bbc366ba5e10,2017-11-21T20:55:10Z,text/html,en,,,,,,,,,,,,,,,,,,,,,,,,,,,,,,,,,,,,,,,,,,,,,
https://www.contractsfinder.service.gov.uk/Published/Notice/releases/ae3a5b86-030c-4cea-9285-a8f5888659cb.json,2017-11-21T17:45:06Z,"Cabinet Office",GB-GOR,D2,https://www.gov.uk/government/organisations/cabinet-office,1.1,https://standard.open-contracting.org/profiles/eu/master/en/extension.json,https://raw.githubusercontent.com/portaledcahn/ocds_tenderDatePublished_extension/master/extension.json,https://raw.githubusercontent.com/open-contracting-extensions/ocds_budget_breakdown_extension/master/extension.json,https://raw.githubusercontent.com/Crown-Commercial-Service/ocds_awards_datePublished_extension/main/extension.json,https://raw.githubusercontent.com/Crown-Commercial-Service/ocds_partyDetails_vcse_extension/main/extension.json,https://raw.githubusercontent.com/Crown-Commercial-Service/ocds_tender_suitability_extension/main/extension.json,https://raw.githubusercontent.com/open-contracting-extensions/ocds_pagination_extension/master/extension.json,http://www.nationalarchives.gov.uk/doc/open-government-licence/version/3/,https://www.gov.uk/government/publications/open-contracting,ocds-b5fd17-d378753c-3777-4ee5-af73-3505d4b0248e,ae3a5b86-030c-4cea-9285-a8f5888659cb-183267,en,2017-11-21T17:45:06Z,tender,tender,,,,,,,,,,,,,,,,,,,,,,,,MT204230,"Gas decommissioing at tower blocks","To decommission the gas supply at 3 tower blocks",2017-11-21T17:45:06Z,active,CPV,98391000,"Decommissioning services",CPV,45231221,"Gas supply mains construction work",,,,,,,,,,,,,,,,,,,,,,,,,,,,,,,,,,,,,1,"North West","United Kingdom",,,,,,,,,,,,,,28000,GBP,,,,,,,60000,GBP,open,"Open procedure (below threshold)",2017-12-08T23:59:59Z,,2018-01-22T00:00:00Z,2018-03-16T23:59:59Z,,,works,1,tenderNotice,"Opportunity notice on Contracts Finder",https://www.contractsfinder.service.gov.uk/Notice/ae3a5b86-030c-4cea-9285-a8f5888659cb,2017-11-21T17:45:06Z,text/html,en,2,tenderNotice,"NOTE: To register your interest in this notice and obtain any additional information please visit the myTenders Web Site at the link provided.",http://www.mytenders.org/search/show/search_view.aspx?ID=NOV148791,,,,,,,,,,,,,,,,,GB-CFS-17100,"Irwell Valley Housing Association","Irwell Valley Housing Association",,,"Paragon House,, 48 Seymour Grove",Manchester,"M16 0LN",England,"Michelle Cunningham",michelle.cunningham@irwellvalleyha.co.uk,"+44 1616101000",http://www.irwellvalleyha.co.uk,buyer,,,,,,,,,,,,,,,,,,,,,,GB-CFS-17100,"Irwell Valley Housing Association",,,,,,,,,,,,,,,,,,,,,,,,,,,,,,,,,,,,,,,,,,,,,,,,,,,,,,,,,,,,,,,,,,,
